title,text
Афта,"Други имена: афтозна язва, устна афта. Англ: Canker sore, аphthous ulcer Какво е устна афта Афтите са малки ранички в устната кухина. Обикновено те засягат вътрешната страна на бузите, но могат също да се появят под и на езика, по венците, небцето и от вътрешната страна на устните. По-рядко афти се наблюдават и по задната част на гърлото. Причини, рискови фактори и превенция Какво точно причинява устните афти, не е известно. Понякога те се дължат на вирусна инфекция, особено след разраняване в устната кухина, например при хранене или час при зъболекаря. Какво още е възможно да предизвиква появата на афти:  Много кисели или люти храни, както и ястия с много подправки Разраняване на устата заради много твърда четка за зъби Отслабена имунна система, т.е. след боледуване Лоша хигиена и замърсяване на устната кухина Повишена чувствителност към някаква храна като шоколад, ананас, ягоди, или ядки Липса на витамини и минерали, особено на желязо, витамин B12 и фолиева киселина (т.е. витамин B9) Алергии Стрес Хормонални промени по време на пубертет или менопауза  Симптоми Афтите могат да бъдат малки и големи. Големите понякога оставят белези. Обикновено афтите започват като зачервени петна или издутини, които имат бял или жълтеникав център. С времето се разраняват. Цветът им често става сив, когато започват да зарастват. Устните афти понякога болят и създават неприятно усещане при хранене. Относително рядко афтите могат да предизвикат повишена температура, чувство за отпадналост или подуване на лимфните възли. Лечение Устните афти обикновено нямат нужда от специфично лечение и изчезват сами за няколко дни. Ако раничките не преминават или са много болезнени, лекуващият лекар ще установи причината за тях и ще предпише подходящи антисептични мазила или лекарства. Какво помага:  Използвайте вода за уста Не яжте люти, пикантни или кисели храни Жабуркането (или гаргара, ако афтата е на гърлото) със сода за хляб (1 кафена лъжичка в ½ чаша топла вода). Не гълтайте соления разтвор, а го изплюйте Намазване на афтата с магнезиево мляко или със сода за хляб (т.е. сода бикарбонат, която трябва съвсем леко да смесим с вода, за да стане на кашица, преди да я мажем) Използвайте мека четка за зъби и неагресивна паста  Ако афтите ви измъчват, попитайте аптекаря какво може да ви препоръча за облекчаване на симптомите. Съществуват множество продукти, които могат да помогнат и се продават без рецепта. Някои от тях съдържат малки количества лекарствени вещества и затова е разумно да прочетем листовката и да следваме указанията в нея. Прогноза и възможни усложнения Афтите са неприятни, но безопасни. Почти винаги те преминават сами и без дълготрайни последици Посъветвайте се със специалист, ако афтите не преминават повече от две седмици или се появяват повече от 3-4 пъти годишно. Връзки:  Canker Sores by US National Library ofMedicine – EN   Желаем ви здраве! Моля ви, не забравяйте, че никаква информация или съвет не може и не трябва да заменя консултация, преглед и лечение при лекар. Проверил: Д-р Пламен Симеонов, неврохирург, Военномедицинска академия, София."
Аутизъм,"Други имена: аутистично разстройство. Англ: Autism, Autistic spectrum disorder (ASD) Какво е аутистично разстройство Аутизмът е разстройство на нормалното развитие на детето, което се проявява в първите три години от живота. То засяга развитието и изграждането на мозъка, а оттам и способността на детето да разбира света и да общува с другите. Децата с аутизъм имат трудности да учат и запомнят. Вниманието им е фокусирано върху прости и повтарящи се дейности, което води до сериозна неспособност да подържат социален или професионален живот. Аутизмът се открива и диагностицира трудно. Съвременната медицина говори за спектър от аутистични разстройства, най-лекото от които е синдромът на Аспергер. Причини, рискови фактори и превенция Не е известно какво поражда аутизма. Има основания да се счита, че състоянието се дължи на действието на някои гени, но това не е доказано. Аутизмът не се причинява от:  Ваксини. Поредица големи клинични изследвания с десетки хиляди деца търсят връзка между различни ваксини и аутистичните разстройства. Оказва се, че такава връзка не съществува, т.е. аутизмът се среща еднакво често при ваксинирани и неваксинирани деца Определени храни или диети, недохранване или липса на витамини и минерали Съединения на живака или алуминия и тяхното наличие в кръвта  Момчетата аутисти са около 4 пъти повече от момичетата. Горните три хипотези, ако бяха верни, щяха да водят до еднаква честота на състоянието при двата пола. Симптоми Признаците на разстройство от аутистичния спектър са изключително много и изключително общи и неясни. Поради тази причина разпознаването и диагностицирането на аутистично разстройство е много трудно. Най-общо децата с аутизъм често са по-свенливи, обичат да се занимават сами, силно се привързват към реда и рутината, имат трудности с ученето, говоренето и движението, избягват очен контакт и не обичат да ги прегръщат, лицата им са безизразни, говорът е механичен, не са емоционални, не играят игри, изискващи въображение, не си измислят неща; и много други. Децата аутисти трудно се справят с неочаквани и непредвидими ситуации. Ето защо те общуват по-трудно с хората и учат по-лесно от компютри. Няма дете, при което да няма поне няколко от признаците на аутизма. Кога да се посъветваме със специалист:  Когато детето не реагира на усмивка или на щастливо изражение на лицето към 6 месец Когато не имитира звуци или мимики към 9 месец Когато не гука и бърбори по бебешки към 12 месец Когато не жестикулира (например не сочи и не размахва ръце) към 14 месец Когато не използва нито една дума към 16 месец Когато не си фантазира неща и не се прави, че измисленото го има, към 18 месец Когато не използва минифрази от две изречения към 24 месец Когато забравя думи, които вече са били научени, или губи придобити социални умения. В този случай възрастта няма значение  Всяко дете е различно и особено. Аутизмът не се среща често и за радост в повечето случаи притесненията на родителите са неоснователни. И все пак развитието на детето с аутистично разстройство и шансът му за относително нормален живот е толкова по-висок, колкото по-рано започнат специалните грижи и занимания. Не отлагайте срещата със специалист, ако детето ви се отличава значително от другите деца. Лечение Тъй като причината за аутизма не е открита, той не се лекува. Това не означава, че състоянието не може да се подобри и контролира! Целта на терапията при аутистично разстройство е да се подпомогне развитието на детето и способността му да научава нови неща. Потискането на симптомите на аутизма спомага за по-добро социално интегриране. В общия случай хората с аутизъм имат особени специфични таланти, например способност за изключително бързо четене, фотографска памет, позволяваща да се нарисува подробно копие на картина, която е виждана само веднъж, или пък умение да се разглобяват и сглобяват обратно сложни уреди като компютър от ранна детска възраст и без съответно обучение. Поощавянето на тази таланти е препоръчително и полезно. Няма лекарства, които да помагат при аутизъм. Възможно е лекарят да предпише медикаменти заради съпътстващо аутизма състояние или, в редки случаи, за да реши проблеми като безсъние, хиперактивност или прекомерна агресия. Основното, от което се нуждае дете с аутизъм, са грижа и внимание. Съществуват множество различни терапии за аутистични разстройства. Всички те се стремят да подпомогнат ученето на детето и да го избавят от симптомите, които пречат на общуването. Често аутизмът е съпътстван от друг проблем като епилепсия, астма или безсъние. Тези трябва да се лекуват. Прогноза и възможни усложнения Повечето хора с аутизъм успяват да живеят със семействата си и да се впишат донякъде в обществото. Доколко те ще имат относително нормален живот, зависи от силата на симптомите им и степента на ефективност на терапията. Около 20% от работещите в САЩ страдат от някакво психично разстройство. Много от тези хора са именно с разстройство от аутистичния спектър. В момента се смята, че между един милион и милион и половина души в САЩ проявяват симптоми на аутизъм. Повечето от тях живеят нормален живот. Връзки:  Асоциация аутизъм Игри за деца с аутизъм @ autismspeaks.org – EN Autism in details & in more details – EN National Autism Association – EN Autism-society.org – EN   Желаем ви здраве! Моля ви, не забравяйте, че никаква информация или съвет не може и не трябва да заменя консултация, преглед и лечение при лекар. Проверил: Д-р Нора Владимирова, Bispebjerg and Frederiksberg Hospital, Копенхаген, Дания."
Родилни петна,"Други имена: Белег по рождение. Англ: Birthmarks Какво е родилно петно Родилното петно е част от кожата с различен от нормалния цвят. Въпреки името си някои родилни петна се появяват известно време след раждането. Има много различни видове родилни петна. Повечето не са опасни за здравето на детето и не са симптом на някакво заболяване. Областите с различна пигментация се срещат буквално при всички хора. Някои вродени петна изчезват с времето. Тези, които остават, могат да са причина за козметични проблеми и породените от това психически проблеми като ниско самочувствие. Видове родилни петна Бенки. Буквално всички хора имат бенки. Бенките са малки групи кожни клетки с различен цвят. Бенките са безопасни в повечето случаи. Потърсете лекар в случай, че бенките нарастват, появяват се нови с нетипичен цвят или има сърбеж, болка, кървене. Невус симплекс. Наричат се още розови петна или „ангелска целувка”. Около една трета от бебетата имат такива петна. Те се дължат на разширени кръвоносни съдове и не са опасни. Розовите петна по лицето обикновено изчезват до 18 месец, докато тези по врата често остават за цял живот. При нужда могат да се премахват хирургически. Портвайн петна. Наричани още невус фламеус, те се дължат на разширени кръвоносни съдове. При раждането са розови, но с времето потъмняват и изглеждат тъмночервени или морави. Обикновено се появяват на лицето и нерядко създават козметичен дискомфорт с възрастта. Портвайн петната се срещат рядко и не са опасни. Възможно е да се отстранят чрез лазерна хирургия, но методът невинаги е ефективен и безопасен. Монголоидини петна. Те са сини или сиво-сини петна по гърба или дупето на детето. Обикновено изчезват до пълнолетие и са напълно безопасни. Премахването им е излишно и непрепоръчтелно. Петна с цвят на кафе с мляко (сметана). Името им идва от френското cafe au lait и се дължи на нежния им кафяв цвят. Тези петна не са опасни, но може да са симптом на заболяване. В случай че детето има няколко големи кафяви петна по кожата, консултирайте се с лекар. Хемангиоми. Това са петна, дължащи се на ненормално образуване и струпване на кръвоносни съдове на определено място по тялото. За разлика от другите родилни петна тези са подути и изпъкнали. Хемангиомите се появяват най-често няколко месеца след раждането и бързо нарастват. За щастие с времето хемангиомите се свиват и постепенно изчезват. В повечето случаи до към 10-тата година натрупаната червена тъкан напълно изчезва. Този тип родилни петна се лекуват трудно като лечението има много доста странични ефекти и не е много подходящо за деца. В повечето случаи лекарите ще изчакат поне до десетата година, за да видят дали петната ще изчезнат сами както става най-често. Прогноза и възможни усложнения Повечето родилни петна са безопасни. Тъй като те се виждат много ясно при преглед още при раждането или скоро след това, детските лекари ги регистрират и оценяват. Това означава, че много рядко има защо да се тревожим, че детето ни е болно. Родилните петна много рядко водят до рак на кожата. Невинаги пластичната хирургия е препоръчителна за премахване на петната. Проучете рисковете добре и се консултирайте с повече от един специалист, преди да вземете решение. Връзки:  Slide show: Birthmarks by Mayo Clinic – EN Бенки by NHS Choices – EN Port-wine stain by the British Association of Dermatologists– EN Hemangioma by Mayo Clinic – EN   Желаем ви здраве! Моля ви, не забравяйте, че никаква информация или съвет не може и не трябва да заменя консултация, преглед и лечение при лекар. Проверил: Д-р Нора Владимирова, Bispebjerg and Frederiksberg Hospital, Копенхаген, Дания."
